{
  "schema_version": "unreal-audit-handoff@1.0.0",
  "report_id": "report-4cdf1836e2bd3807",
  "report_created_at": "2026-08-31T05:45:01.183361+00:00",
  "profile_id": "host-material-evidence-v3",
  "profile_version": "3.0.0",
  "collection_mode": "unreal_editor",
  "real_unreal_validation": true,
  "host_engine_version": "5.8.1-56057345+++UE5+Release-5.8",
  "validation_label": "真实 Unreal 宿主采集",
  "validation_boundary": "资产事实由报告记录的 Unreal Editor 宿主采集；导出过程只读取报告，不重新扫描或修改资产。",
  "summary": {
    "requested_asset_count": 20,
    "processed_asset_count": 2,
    "cancelled_asset_count": 18,
    "asset_count": 2,
    "issue_count": 4,
    "collection_failure_count": 0
  },
  "files": [
    {
      "path": "审计交接报告.html",
      "sha256": "e4617015241c84bfe4ab268867b1aec81bc29701810d3f5f97bf624bbcec1750"
    },
    {
      "path": "审计问题明细.csv",
      "sha256": "c297a03a8ae14ae5c81a4151e63a68a56093e2af1a4aea72c7646391e52ddb49"
    },
    {
      "path": "交付目录热区.csv",
      "sha256": "ed9f41d6ab5b0935565fed78006392b568e1c1877c76058d306a3210ba7403c1"
    }
  ],
  "delivery_groups": {
    "schema_version": "unreal-audit-delivery-groups@1.0.0",
    "grouping_rule": "package_parent_first_3_segments",
    "ranking_rule": "采集失败 > 需修复 > 问题密度 > 问题数 > 目录路径",
    "group_count": 1,
    "groups_csv_file": "交付目录热区.csv",
    "groups_csv_sha256": "ed9f41d6ab5b0935565fed78006392b568e1c1877c76058d306a3210ba7403c1",
    "performance_inference": false,
    "boundary": "问题/对象仅表示规则问题密度，不推断 FPS、GPU、Shader、Cook 或资产质量。"
  }
}
