{
  "schema_version": "unreal-audit-handoff@1.0.0",
  "report_id": "report-ead7b262974bf3ab",
  "report_created_at": "2026-08-31T05:45:01.147530+00:00",
  "profile_id": "host-material-evidence-v3",
  "profile_version": "3.0.0",
  "collection_mode": "unreal_editor",
  "real_unreal_validation": true,
  "host_engine_version": "5.8.1-56057345+++UE5+Release-5.8",
  "validation_label": "真实 Unreal 宿主采集",
  "validation_boundary": "资产事实由报告记录的 Unreal Editor 宿主采集；导出过程只读取报告，不重新扫描或修改资产。",
  "summary": {
    "requested_asset_count": 5,
    "processed_asset_count": 5,
    "cancelled_asset_count": 0,
    "asset_count": 5,
    "issue_count": 9,
    "collection_failure_count": 0
  },
  "files": [
    {
      "path": "审计交接报告.html",
      "sha256": "56225c8f634ee1950c56bda752cc032189fce5bb339479bb6bd82f70bc13b83f"
    },
    {
      "path": "审计问题明细.csv",
      "sha256": "c879c8a7b9b82d877f93efd36963038eaae54cd9cf96f049ab0217bc615d40ab"
    },
    {
      "path": "交付目录热区.csv",
      "sha256": "696bbebe0f22f357454e6b14c0b33178acceaaaa5a2fddbffd7bed78d552c2c0"
    }
  ],
  "delivery_groups": {
    "schema_version": "unreal-audit-delivery-groups@1.0.0",
    "grouping_rule": "package_parent_first_3_segments",
    "ranking_rule": "采集失败 > 需修复 > 问题密度 > 问题数 > 目录路径",
    "group_count": 2,
    "groups_csv_file": "交付目录热区.csv",
    "groups_csv_sha256": "696bbebe0f22f357454e6b14c0b33178acceaaaa5a2fddbffd7bed78d552c2c0",
    "performance_inference": false,
    "boundary": "问题/对象仅表示规则问题密度，不推断 FPS、GPU、Shader、Cook 或资产质量。"
  }
}
